{
  "operation": "restore",
  "purpose": "Restaurar un recurso eliminado de forma reversible",
  "risk": "low",
  "initiator": "agent",
  "fields": [
    {"name": "resource_ref", "type": "opaque_reference", "sensitivity": "private", "required": true}
  ],
  "validation": {"preflight": "resource_is_in_trash"},
  "confirmation": {"method": "user_accept", "required": true},
  "expires_in_seconds": 300
}
